name,category,address,review_index,review_text,review_info,visit_time
디오니스 먹골역점,"맥주,호프",도로명서울 중랑구 동일로157길 19 1층복사 지번서울 중랑구 묵동 244-140복사,1,일바생이 센스 넘친다는 리뷰가 있었는데 진짜입니다 센스베리 넘침.. 미쳤다 가성비도 좋고 맛도 좋고 또갈집🤤,방문일 25.10.2.목 2025년 10월 2일 목요일 1번째 방문 인증 수단 영수증,저녁에 방문예약 없이 이용대기 시간 바로 입장친목친구
디오니스 먹골역점,"맥주,호프",도로명서울 중랑구 동일로157길 19 1층복사 지번서울 중랑구 묵동 244-140복사,2,맛있어요~~~ 맥주한잔 하기좋은곳입니다!!,방문일 25.6.23.월 2025년 6월 23일 월요일 1번째 방문 인증 수단 결제내역,저녁에 방문대기 시간 바로 입장친목지인・동료
디오니스 먹골역점,"맥주,호프",도로명서울 중랑구 동일로157길 19 1층복사 지번서울 중랑구 묵동 244-140복사,3,나쁘지 않아요,방문일 25.7.27.일 2025년 7월 27일 일요일 1번째 방문 인증 수단 영수증,저녁에 방문예약 없이 이용대기 시간 바로 입장일상연인・배우자
디오니스 먹골역점,"맥주,호프",도로명서울 중랑구 동일로157길 19 1층복사 지번서울 중랑구 묵동 244-140복사,4,,방문일 25.5.24.토 2025년 5월 24일 토요일 21번째 방문 인증 수단 영수증,점심에 방문예약 없이 이용대기 시간 바로 입장
디오니스 먹골역점,"맥주,호프",도로명서울 중랑구 동일로157길 19 1층복사 지번서울 중랑구 묵동 244-140복사,5,,방문일 25.2.8.토 2025년 2월 8일 토요일 20번째 방문 인증 수단 영수증,점심에 방문예약 없이 이용대기 시간 바로 입장
디오니스 먹골역점,"맥주,호프",도로명서울 중랑구 동일로157길 19 1층복사 지번서울 중랑구 묵동 244-140복사,6,"여기 찐맛집이에요,,, 새로운 맛집 가는 거 좋아하는 타입인데 여기는 최소 10번 이상 4-5년 가는 또간집입니당ㅎㅎ 근방 동네 사람들은 다 아는 맛집! 친절함, 서비스, 음식의 맛과 양, 가격까지 좋은 곳입니다. 꼭 꼭 한번만 들러보세용! 와서 먹는 반반치킨은 진심으로 브랜드치킨들 저리가라.. 항상 치킨 먹고싶을 때마다 생각나구요 누들떡볶이랑 가성비세트도 있어서 고민안해도 되요ㅠㅠ 제육두부한판이랑 돈까스도 진짜 맛있구요, 이런 메뉴 드실 때 간장계란밥 꼭 추가해서 드세요! 수제간장이랑 볶음김치까지 든든 술안주에요..🥺💓 술 종류도 개발하신 하이볼이 완전 많아져서 선택의 폭이 넓어요! 화장실도 깨끗하고 관리잘하세용 접기",방문일 24.8.3.토 2024년 8월 3일 토요일 1번째 방문 인증 수단 결제내역,"저녁에 방문예약 없이 이용대기 시간 바로 입장가족모임연인・배우자, 부모님"
디오니스 먹골역점,"맥주,호프",도로명서울 중랑구 동일로157길 19 1층복사 지번서울 중랑구 묵동 244-140복사,7,잘먹고갑니당!!,방문일 24.10.31.목 2024년 10월 31일 목요일 3번째 방문 인증 수단 영수증,저녁에 방문
디오니스 먹골역점,"맥주,호프",도로명서울 중랑구 동일로157길 19 1층복사 지번서울 중랑구 묵동 244-140복사,8,,방문일 24.12.18.수 2024년 12월 18일 수요일 19번째 방문 인증 수단 영수증,저녁에 방문예약 없이 이용대기 시간 바로 입장
디오니스 먹골역점,"맥주,호프",도로명서울 중랑구 동일로157길 19 1층복사 지번서울 중랑구 묵동 244-140복사,9,후라이드치킨 정말 맛나요,방문일 24.10.14.월 2024년 10월 14일 월요일 4번째 방문 인증 수단 영수증,아침에 방문예약 없이 이용대기 시간 바로 입장일상아이
디오니스 먹골역점,"맥주,호프",도로명서울 중랑구 동일로157길 19 1층복사 지번서울 중랑구 묵동 244-140복사,10,치킨이 깔끔하고 정말 맛있어요,방문일 24.9.24.화 2024년 9월 24일 화요일 3번째 방문 인증 수단 영수증,저녁에 방문예약 없이 이용친목친구
관동식당 묵동점,요리주점,도로명서울 중랑구 동일로 942 1층복사 지번서울 중랑구 묵동 169-11복사,1,"관동식당은 늘 저녁에만 방문했었은데, 메뉴가 리뉴얼 되었길래 점심에 후다닥 다녀왔습니다. 점심식사로 딱 좋은 메뉴 구성이라 너무 만족스러웠습니당💙 맛은 당연히 맛있고 늘 좋은 서비스로 기분까지 좋아지는 관동식당은 언제나 라뷰라뷰입니당✨💛 접기",방문일 24.8.22.목 2024년 8월 22일 목요일 2번째 방문 인증 수단 영수증,점심에 방문예약 없이 이용대기 시간 바로 입장데이트연인・배우자
관동식당 묵동점,요리주점,도로명서울 중랑구 동일로 942 1층복사 지번서울 중랑구 묵동 169-11복사,2,"유린기와 사시미를 시켰습니다 사시미를 소금에 찍어먹는건 처음이었는데 다양한 풍미와 식감, 맛에 놀랐어요 유린기도 못지않게 맛있었습니다  분위기는 나이대가 다양하고 금요일 밤이어서 그런지 시끌시끌했고 이야기 나누기엔 좋았으나 등받이가 없는 의자라서 오래 앉아있기에는 불편해서 후딱 먹고 나왔어요  술 종류 다양하고 생맥주는 아사히랑 테라가 있는데 둘 다 신선합니다 날이 너무 더워서 저는 테라가 더 개운하게 느껴졌네요  분위기 낼 겸 가보기 좋습니다 접기",방문일 24.6.14.금 2024년 6월 14일 금요일 1번째 방문 인증 수단 영수증,저녁에 방문예약 없이 이용대기 시간 바로 입장
관동식당 묵동점,요리주점,도로명서울 중랑구 동일로 942 1층복사 지번서울 중랑구 묵동 169-11복사,3,사장님... 이 가격에 이 구성 맞아요? 진짜 너무 가성비 좋은데 맛도 좋고 퀄리티까지 좋으면 뭐 남으시나요 전 메뉴 정말 다 맛있구 직원분들 모두 다 친절하시고 메뉴마다 설명 잘 해주셔서 너무 좋았습니다 담에 또 올게요 :) 접기,방문일 24.5.31.금 2024년 5월 31일 금요일 1번째 방문 인증 수단 영수증,저녁에 방문예약 없이 이용대기 시간 바로 입장친목친구
관동식당 묵동점,요리주점,도로명서울 중랑구 동일로 942 1층복사 지번서울 중랑구 묵동 169-11복사,4,정말 매주 가는데 사장님이 항상 친절하시고 음식 맛도 변함없이 맛있습니다👍🏻👍🏻 먹골역 근처에서는 넘버원입니다🥇 접기,방문일 24.1.30.화 2024년 1월 30일 화요일 2번째 방문 인증 수단 영수증,저녁에 방문예약 없이 이용대기 시간 바로 입장데이트연인・배우자
관동식당 묵동점,요리주점,도로명서울 중랑구 동일로 942 1층복사 지번서울 중랑구 묵동 169-11복사,5,여기 사시미 괜찮아요~~~ 기본안주로 죽 나오고 콩 나오는 거 넘 좋구요! 그리구 사장님이 우니 시켰는데 솔직하게 맛없으니 다음에 드시라구 한 것두 좋았어요 그래서 구이류도 한 번 먹어보구 싶긴 해요! 접기,방문일 23.12.21.목 2023년 12월 21일 목요일 1번째 방문 인증 수단 영수증,"저녁에 방문예약 없이 이용대기 시간 바로 입장데이트, 친목연인・배우자, 친구"
관동식당 묵동점,요리주점,도로명서울 중랑구 동일로 942 1층복사 지번서울 중랑구 묵동 169-11복사,6,셋이가서 안주 뿌시고 왔어요 메뉴 하나하나 어찌 그리 다 맛있는지 신라출신 셰프님 정성이랑 고민이 느껴지는 음식들 집이랑 가까우면 더 자주갔을텐데ㅠㅠ 맛있게 잘 먹고 갑니다 또 갈게요👍🏻 접기,방문일 23.11.4.토 2023년 11월 4일 토요일 1번째 방문 인증 수단 영수증,저녁에 방문
관동식당 묵동점,요리주점,도로명서울 중랑구 동일로 942 1층복사 지번서울 중랑구 묵동 169-11복사,7,메뉴 하나하나 정말 신선하면서 정성스럽고 최고의 맛과 서비스 입니다! 저녁에 먹기에도 부담없어서 좋아요  참치피자는 꼭 드세요 먹고나서도 생각나는 맛입니다 고급스럽고 식감 풍미 모두 잡은 메뉴에요  모둠사시미도 가성비도 좋고 신선하면서 고급지구 재료 하나 하나 식감이 너무 좋네요  묵동 맛집 다워요 태릉입구역 이랑 먹골역 중간에 있어서 가기도 편하구 재방문 100프로 맛집 입니다 💛  너무 정성스러운 음식 대접받은 기분이에요👍🏻💛👍🏻💛👍🏻💛 접기,방문일 23.11.9.목 2023년 11월 9일 목요일 1번째 방문 인증 수단 영수증,밤에 방문
관동식당 묵동점,요리주점,도로명서울 중랑구 동일로 942 1층복사 지번서울 중랑구 묵동 169-11복사,8,"맛도 최고 분위기도 최고에요....♡ 숙성회 전문점이라고 해서 회만 기대하고 갔는데 다른 메뉴들도 정말 맛있더라구요^0^ 신선하고 쫀득한 회에 국물맛이 예술인 스키야키, 서비스로 주신 한우 차돌 육사시미까지...! 먹을수록 양이 줄어드는 게 아쉽기만한 맛도리 안주들이었어요 ㅎㅎㅎ 새로운 맛집을 알게 돼서 넘 행복한 저녁이었숩니당..히히 자주 들러야겠어요~~~ 접기",방문일 23.11.15.수 2023년 11월 15일 수요일 1번째 방문 인증 수단 영수증,"저녁에 방문예약 없이 이용대기 시간 바로 입장데이트, 일상연인・배우자"
관동식당 묵동점,요리주점,도로명서울 중랑구 동일로 942 1층복사 지번서울 중랑구 묵동 169-11복사,9,플레이팅도 이렇게 예쁘게 나오네 하며 놀랐는데 맛도 기대 이상이라 넘 좋았던 곳이에요! 메뉴 하나하나 다 맛있고 소스 하나도 남달라서 싹싹 다 먹게 됩니다ㅋㅋ 이래서 손님이 많구나 먹어보면 알게 되는 곳ㅋㅋ다음에 또 갈게요^^ 접기,방문일 23.11.14.화 2023년 11월 14일 화요일 1번째 방문 인증 수단 영수증,저녁에 방문
관동식당 묵동점,요리주점,도로명서울 중랑구 동일로 942 1층복사 지번서울 중랑구 묵동 169-11복사,10,회가 진짜 너무 싱싱하고 입게 들어가면 사르륵 녹아요. 이번에 새로 오픈해서 가본거였는데 진짜 너무 맛있어요. 게다가 평소에 오뎅 정말 너무 좋아하는데 여기 오뎅탕은 진짜 육수부터 중독적인 맛이에요ㅜㅜ 진짜 꼭 드세요!! 사장님께서 차돌로 다양한 메뉴까지 개발하시는데 진짜 고기 질 자체가 너무 좋아요!! 여긴 또 재방문 할 수 밖에 없는 곳이에요. 접기,방문일 23.11.8.수 2023년 11월 8일 수요일 1번째 방문 인증 수단 영수증,저녁에 방문
관동식당 묵동점,요리주점,도로명서울 중랑구 동일로 942 1층복사 지번서울 중랑구 묵동 169-11복사,11,친절하고 맛있어요~ 회는 숙싱회이니 식성 참고하세요~^^,방문일 24.2.9.금 2024년 2월 9일 금요일 1번째 방문 인증 수단 영수증,저녁에 방문예약 없이 이용대기 시간 바로 입장친목친구
관동식당 묵동점,요리주점,도로명서울 중랑구 동일로 942 1층복사 지번서울 중랑구 묵동 169-11복사,12,첫 방문인데.. 메뉴도 다양하고 맛도 좋네요. 친구들도 만족스럽다고 하네요.,방문일 24.1.3.수 2024년 1월 3일 수요일 1번째 방문 인증 수단 영수증,저녁에 방문예약 없이 이용대기 시간 바로 입장친목친구
관동식당 묵동점,요리주점,도로명서울 중랑구 동일로 942 1층복사 지번서울 중랑구 묵동 169-11복사,13,진짜 가보싶던 곳 관동식당!!! 역시나 기대보다 더더 맛있게 먹고갑니다🧡 친절하신 사장님 직원분들 감사합니다:),방문일 24.1.2.화 2024년 1월 2일 화요일 1번째 방문 인증 수단 영수증,"저녁에 방문예약 없이 이용대기 시간 바로 입장친목, 가족모임"
관동식당 묵동점,요리주점,도로명서울 중랑구 동일로 942 1층복사 지번서울 중랑구 묵동 169-11복사,14,난 여기 진짜 좋아함,방문일 24.3.26.화 2024년 3월 26일 화요일 2번째 방문 인증 수단 영수증,밤에 방문예약 없이 이용대기 시간 바로 입장데이트연인・배우자
관동식당 묵동점,요리주점,도로명서울 중랑구 동일로 942 1층복사 지번서울 중랑구 묵동 169-11복사,15,동네에 괜찮은 이자카야가 없었는데 진짜 너무 좋아요! 가성비도 너무 좋구요! 사장님께서 손님들과 소통하시려는 모습도 인상적이고 하나하나 신경쓰시는게 느껴져서 믿고 갑니다^_^ 다들 그냥 지나치지 마시고 한번씩 들러서 간단히라도 먹어보세요!!!! 후회 없으실거에요!! 이상 숙성회와 술을 좋아하는 단골이였습니다🤎 접기,방문일 23.10.31.화 2023년 10월 31일 화요일 1번째 방문 인증 수단 영수증,저녁에 방문
관동식당 묵동점,요리주점,도로명서울 중랑구 동일로 942 1층복사 지번서울 중랑구 묵동 169-11복사,16,"동네에서 2차로 간단하게 먹을 곳을 찾다가 새로 오픈해서 왔는데 너무나 만족했습니다.🤗  🫧다들 친절하시고, 매장이 깨끗해서 좋았습니다. 🍻모듬사시미 구성이 좋았는데 회가 전부 맛있어서 한점에 소주 한 잔씩이였습니다. ➕그리고 사장님이 후하게 서비스도 주셨는데 전부 맛있어서 다음에 또 가서 시켜먹으려고 합니다.^^ 🎉결론 : 단골집 하나 생길 것 같습니다.🫰🏻 접기",방문일 23.10.25.수 2023년 10월 25일 수요일 1번째 방문 인증 수단 영수증,저녁에 방문
관동식당 묵동점,요리주점,도로명서울 중랑구 동일로 942 1층복사 지번서울 중랑구 묵동 169-11복사,17,지나가다 사람이 많아서 남편이랑 데이트하러 갔다가 완전 미각힐링 당하고 가요!! :) 차돌 육사시미도 맛있었지만 나가사키짬뽕이랑 꼬치가 정말 맛있었어요❤️,방문일 23.11.16.목 2023년 11월 16일 목요일 1번째 방문 인증 수단 영수증,저녁에 방문예약 없이 이용대기 시간 바로 입장데이트연인・배우자
관동식당 묵동점,요리주점,도로명서울 중랑구 동일로 942 1층복사 지번서울 중랑구 묵동 169-11복사,18,너무 맛있게 먹었어요!! 특색있는 요리에 맛까지 겸비해서 너무나 좋네요! 분위기도 좋고 친절하세요~,방문일 23.11.16.목 2023년 11월 16일 목요일 1번째 방문 인증 수단 영수증,저녁에 방문예약 후 이용대기 시간 바로 입장데이트연인・배우자
관동식당 묵동점,요리주점,도로명서울 중랑구 동일로 942 1층복사 지번서울 중랑구 묵동 169-11복사,19,"사시미를 먹으려고 했는데, 날이 추워서 오뎅국물이 땡기더라구요. 그래서 오뎅나베와 크림 파스타를 시켰는데, 너무 맛있네요. 알아서 오뎅국물도 추가해줘서 좋았어요. 접기",방문일 24.1.26.금 2024년 1월 26일 금요일 1번째 방문 인증 수단 영수증,저녁에 방문예약 없이 이용대기 시간 바로 입장데이트연인・배우자
관동식당 묵동점,요리주점,도로명서울 중랑구 동일로 942 1층복사 지번서울 중랑구 묵동 169-11복사,20,"사장님과 직원분들이 엄청 친절하세요! 그리고 메뉴가 다양하게 있어서 좋았고, 술집이지만 조명이 밝아서 좋았어요👍 베스트 메뉴인 사시미랑 날이 추워 어묵탕 시켰어요. 사시미가 하나같이 다 비리지 않고, 맛있었음🙂 어묵탕은 국물 직접 만드신다는데 진짜 굿!! 그리고 어묵도 정말 부드러웠어요👍 서비스로 트러플 참치피자와 트러플 한우 차돌 육사시미를 맛 봤는데 진짜... 맛있었어요😋 여긴 진짜 재방문하고 싶은 곳! 접기",방문일 23.11.8.수 2023년 11월 8일 수요일 1번째 방문 인증 수단 영수증,저녁에 방문
관동식당 묵동점,요리주점,도로명서울 중랑구 동일로 942 1층복사 지번서울 중랑구 묵동 169-11복사,21,꼬치 맛있어요 :),방문일 24.4.4.목 2024년 4월 4일 목요일 1번째 방문 인증 수단 영수증,밤에 방문예약 없이 이용대기 시간 바로 입장친목지인・동료
관동식당 묵동점,요리주점,도로명서울 중랑구 동일로 942 1층복사 지번서울 중랑구 묵동 169-11복사,22,술 마시러 갔다가 식사하고 온 곳 메뉴 하나하나 다 맛있고 신선하고 JMT 재방문의사 뿜뿜! 직원분들도 사장님도 친절하시고 분위기도 좋아서 더욱 기분 좋게 먹었어요:) 접기,방문일 23.11.6.월 2023년 11월 6일 월요일 1번째 방문 인증 수단 영수증,저녁에 방문
관동식당 묵동점,요리주점,도로명서울 중랑구 동일로 942 1층복사 지번서울 중랑구 묵동 169-11복사,23,메뉴가 아기자기한데 맛이랑 가성비는 좀 아쉬웟어요.. 맥주가 맛있어요  접기,방문일 24.1.18.목 2024년 1월 18일 목요일 1번째 방문 인증 수단 영수증,저녁에 방문예약 없이 이용대기 시간 바로 입장친목지인・동료
관동식당 묵동점,요리주점,도로명서울 중랑구 동일로 942 1층복사 지번서울 중랑구 묵동 169-11복사,24,새로 오픈했다고 해서 가봤는데 국물 진짜 국진허니 맛있어요 .. 모둠 사시미도 시켰는데 나오자마자 급하게 먹어서 사진을 못찍었지만 사시미 신선도 짱이에요!!! 서비스로 음료수 받았는데 너무 감사합니다 ><❤ 가게도 조용하고 사장님도 친절하셔서 너무 좋았어요 ㅎㅎ 주말에 약속있는데 집근처라 또 방문할 예정.. 접기,방문일 23.10.17.화 2023년 10월 17일 화요일 1번째 방문 인증 수단 영수증,저녁에 방문
관동식당 묵동점,요리주점,도로명서울 중랑구 동일로 942 1층복사 지번서울 중랑구 묵동 169-11복사,25,새로 리뉴얼하였다해서 방문했습니다 전에 숯불꼬치전문점할때도 맛있었는데 이번에 메뉴도 많아지고 맛도 맛나구!! 아사히캔생맥도 있어서 무쟈게 먹고왔습니다 번창하세요!!😆😆 접기,방문일 23.10.21.토 2023년 10월 21일 토요일 1번째 방문 인증 수단 영수증,저녁에 방문예약 없이 이용대기 시간 바로 입장데이트연인・배우자
관동식당 묵동점,요리주점,도로명서울 중랑구 동일로 942 1층복사 지번서울 중랑구 묵동 169-11복사,26,모든 메뉴가 다 맛있음 나는 한우트러플 모츠나베 닭껍질만두 꿀토마토 맛있었음,방문일 23.12.2.토 2023년 12월 2일 토요일 1번째 방문 인증 수단 영수증,저녁에 방문예약 없이 이용대기 시간 바로 입장데이트연인・배우자
관동식당 묵동점,요리주점,도로명서울 중랑구 동일로 942 1층복사 지번서울 중랑구 묵동 169-11복사,27,두번다시는 안갈겁니다 모듬사시미 시켰는데 평소에 정말 생굴 좋아하는데 굴에서 비린내가 너무 심하고 가격에 비해 전부 퀄리티 최악입니다 돈이 너무 아까웠어요 왠만하면 영수증 찍어서 리뷰까지 쓸 열정 절대 없는사람인데 이런걸 돈받고 파시는건 아닌거같아요 접기,방문일 23.11.25.토 2023년 11월 25일 토요일 1번째 방문 인증 수단 영수증,저녁에 방문예약 없이 이용대기 시간 바로 입장데이트연인・배우자
관동식당 묵동점,요리주점,도로명서울 중랑구 동일로 942 1층복사 지번서울 중랑구 묵동 169-11복사,28,매장이 깔끔하고 직원분들이 친절합니다!! 2차로 먹으러 왔는데 가볍게 먹기 좋고 회나 국물 등 메뉴도 많아서 다음에는 1차로 와서 먹어도 좋을거같아요~!!^^ 접기,방문일 23.10.25.수 2023년 10월 25일 수요일 1번째 방문 인증 수단 영수증,저녁에 방문
관동식당 묵동점,요리주점,도로명서울 중랑구 동일로 942 1층복사 지번서울 중랑구 묵동 169-11복사,29,진짜 너무 맛있고 깨끗하고 친절하셔서 또오려구요!!!!,방문일 23.10.21.토 2023년 10월 21일 토요일 1번째 방문 인증 수단 영수증,저녁에 방문
관동식당 묵동점,요리주점,도로명서울 중랑구 동일로 942 1층복사 지번서울 중랑구 묵동 169-11복사,30,자주 지나다니가다 오픈한거 같아서 한번 방문 해봤는데 음식도 너무 맛있고 사장님도 너무 친절해요!,방문일 23.10.21.토 2023년 10월 21일 토요일 1번째 방문 인증 수단 영수증,저녁에 방문
관동식당 묵동점,요리주점,도로명서울 중랑구 동일로 942 1층복사 지번서울 중랑구 묵동 169-11복사,31,안주 이것저것 그냥 시켰는데 다 맛있어요!! 참치피자.. 기대 안 했는데 존맛탱이네요,방문일 23.11.9.목 2023년 11월 9일 목요일 1번째 방문 인증 수단 영수증,저녁에 방문예약 없이 이용대기 시간 바로 입장데이트연인・배우자
관동식당 묵동점,요리주점,도로명서울 중랑구 동일로 942 1층복사 지번서울 중랑구 묵동 169-11복사,32,음식들 너무 맛있고 직원 분들 친절해요 :) 재방문의사 100000% 매장도 청결하고 서비스 너무 좋아요 ❤️💚,방문일 23.10.27.금 2023년 10월 27일 금요일 1번째 방문 인증 수단 영수증,저녁에 방문
관동식당 묵동점,요리주점,도로명서울 중랑구 동일로 942 1층복사 지번서울 중랑구 묵동 169-11복사,33,친구추천으로 2호점 방문했는데...친절하구 서비스도 주셔서 좋았어요^^~~담에 또 방문할께요,방문일 23.10.23.월 2023년 10월 23일 월요일 1번째 방문 인증 수단 영수증,저녁에 방문
관동식당 묵동점,요리주점,도로명서울 중랑구 동일로 942 1층복사 지번서울 중랑구 묵동 169-11복사,34,우리동네에 이런술집이 계셔주셔서 감사합니다..💕,방문일 23.10.27.금 2023년 10월 27일 금요일 1번째 방문 인증 수단 영수증,저녁에 방문
관동식당 묵동점,요리주점,도로명서울 중랑구 동일로 942 1층복사 지번서울 중랑구 묵동 169-11복사,35,맛있어요,방문일 23.11.16.목 2023년 11월 16일 목요일 1번째 방문 인증 수단 영수증,저녁에 방문
건어물가게,"맥주,호프",도로명서울 중랑구 중랑역로 269-2 1층 건어물가게복사 지번서울 중랑구 묵동 166-7복사,1,포장해와서 집와서 먹었는데 너무 가성비좋고 맛있었어요!!🥹👍 중간노가리랑 오징어백족 먹었는데 둘다 실하고맛있어요❣️자주올게요!!,방문일 25.12.15.월 2025년 12월 15일 월요일 1번째 방문 인증 수단 영수증,"저녁에 방문예약 없이 이용대기 시간 바로 입장데이트, 일상"
건어물가게,"맥주,호프",도로명서울 중랑구 중랑역로 269-2 1층 건어물가게복사 지번서울 중랑구 묵동 166-7복사,2,기본안주가 팝콘이라 너무 좋아요!! 생맥주도 클라우드랑 너무 맛있습니다! 태입에서 술먹으면 2차는 무조건 건어물가게에요:) 늘 치즈볼이랑 건안주 하나 시키는데 다음에는 1차로 방문해서 치킨이나 떡볶이도 먹어보고싶어요🤤 접기,방문일 25.12.16.화 2025년 12월 16일 화요일 1번째 방문 인증 수단 결제내역,밤에 방문예약 없이 이용대기 시간 바로 입장친목친구
건어물가게,"맥주,호프",도로명서울 중랑구 중랑역로 269-2 1층 건어물가게복사 지번서울 중랑구 묵동 166-7복사,3,,방문일 1.1.목 2026년 1월 1일 목요일 5번째 방문 인증 수단 영수증,밤에 방문예약 없이 이용대기 시간 바로 입장데이트연인・배우자
건어물가게,"맥주,호프",도로명서울 중랑구 중랑역로 269-2 1층 건어물가게복사 지번서울 중랑구 묵동 166-7복사,4,반건조오징어 맛있어요~~ 기본안주 팝콘이 짭쪼름해서 맥주안주로 좋네요,방문일 25.8.9.토 2025년 8월 9일 토요일 1번째 방문 인증 수단 영수증,"저녁에 방문예약 없이 이용대기 시간 바로 입장가족모임부모님, 친척・형제자매"
건어물가게,"맥주,호프",도로명서울 중랑구 중랑역로 269-2 1층 건어물가게복사 지번서울 중랑구 묵동 166-7복사,5,음식도 빨리나오고 맛잇어요 안주도다양합니다,방문일 25.5.29.목 2025년 5월 29일 목요일 1번째 방문 인증 수단 영수증,밤에 방문예약 없이 이용대기 시간 바로 입장친목
건어물가게,"맥주,호프",도로명서울 중랑구 중랑역로 269-2 1층 건어물가게복사 지번서울 중랑구 묵동 166-7복사,6,건어물에 진심인곳‼️생맥주랑 간단하게 먹기 좋은거같어요👊,방문일 25.5.11.일 2025년 5월 11일 일요일 1번째 방문 인증 수단 영수증,저녁에 방문예약 없이 이용대기 시간 바로 입장친목친구
건어물가게,"맥주,호프",도로명서울 중랑구 중랑역로 269-2 1층 건어물가게복사 지번서울 중랑구 묵동 166-7복사,7,,방문일 25.8.13.수 2025년 8월 13일 수요일 4번째 방문 인증 수단 영수증,저녁에 방문예약 없이 이용대기 시간 바로 입장데이트연인・배우자
