name,category,address,review_index,review_text,review_info,visit_time
뻔뻔,요리주점,"도로명서울 중랑구 동일로149길 15 우성아파트 상가 1층(구, 중랑경찰서 맞은편)복사 지번서울 중랑구 묵동 250-17복사",35,다 맛있음!!!! 나가사키 짬뽕 맛있고~ 오뎅탕 맛있고~ 우삼겹숙주볶음도 맛있고~,방문일 22.9.4.일 2022년 9월 4일 일요일 1번째 방문 인증 수단 영수증,저녁에 방문
뻔뻔,요리주점,"도로명서울 중랑구 동일로149길 15 우성아파트 상가 1층(구, 중랑경찰서 맞은편)복사 지번서울 중랑구 묵동 250-17복사",36,정말 맛있게 먹었어요,방문일 22.9.4.일 2022년 9월 4일 일요일 1번째 방문 인증 수단 영수증,저녁에 방문
뻔뻔,요리주점,"도로명서울 중랑구 동일로149길 15 우성아파트 상가 1층(구, 중랑경찰서 맞은편)복사 지번서울 중랑구 묵동 250-17복사",37,맛있어요👍,방문일 22.7.18.월 2022년 7월 18일 월요일 1번째 방문 인증 수단 영수증,밤에 방문
뻔뻔,요리주점,"도로명서울 중랑구 동일로149길 15 우성아파트 상가 1층(구, 중랑경찰서 맞은편)복사 지번서울 중랑구 묵동 250-17복사",38,굿,방문일 22.7.26.화 2022년 7월 26일 화요일 1번째 방문 인증 수단 영수증,밤에 방문
뻔뻔,요리주점,"도로명서울 중랑구 동일로149길 15 우성아파트 상가 1층(구, 중랑경찰서 맞은편)복사 지번서울 중랑구 묵동 250-17복사",39,친절합니다,방문일 22.10.11.화 2022년 10월 11일 화요일 1번째 방문 인증 수단 영수증,점심에 방문
뻔뻔,요리주점,"도로명서울 중랑구 동일로149길 15 우성아파트 상가 1층(구, 중랑경찰서 맞은편)복사 지번서울 중랑구 묵동 250-17복사",40,맛있고 친절하십니다,방문일 21.12.12.일 2021년 12월 12일 일요일 1번째 방문 인증 수단 영수증,점심에 방문
뻔뻔,요리주점,"도로명서울 중랑구 동일로149길 15 우성아파트 상가 1층(구, 중랑경찰서 맞은편)복사 지번서울 중랑구 묵동 250-17복사",41,친절해요,방문일 21.11.27.토 2021년 11월 27일 토요일 1번째 방문 인증 수단 영수증,저녁에 방문
뻔뻔,요리주점,"도로명서울 중랑구 동일로149길 15 우성아파트 상가 1층(구, 중랑경찰서 맞은편)복사 지번서울 중랑구 묵동 250-17복사",42,유린기~~~니가 왜 거기서나와. 중국집요리^^^ 맛 👌,방문일 21.4.30.금 2021년 4월 30일 금요일 1번째 방문 인증 수단 영수증,저녁에 방문
뻔뻔,요리주점,"도로명서울 중랑구 동일로149길 15 우성아파트 상가 1층(구, 중랑경찰서 맞은편)복사 지번서울 중랑구 묵동 250-17복사",43,모든음식이 너무 맛있습니다,방문일 21.4.3.토 2021년 4월 3일 토요일 1번째 방문 인증 수단 영수증,밤에 방문
뻔뻔,요리주점,"도로명서울 중랑구 동일로149길 15 우성아파트 상가 1층(구, 중랑경찰서 맞은편)복사 지번서울 중랑구 묵동 250-17복사",44,사장님도 친절하시고 음식도 맛있게 잘 먹었습니다^^,방문일 20.11.17.화 2020년 11월 17일 화요일 1번째 방문 인증 수단 영수증,밤에 방문
뻔뻔,요리주점,"도로명서울 중랑구 동일로149길 15 우성아파트 상가 1층(구, 중랑경찰서 맞은편)복사 지번서울 중랑구 묵동 250-17복사",45,자주가요 이모님 좋아요,방문일 20.8.26.수 2020년 8월 26일 수요일 1번째 방문 인증 수단 영수증,저녁에 방문
뻔뻔,요리주점,"도로명서울 중랑구 동일로149길 15 우성아파트 상가 1층(구, 중랑경찰서 맞은편)복사 지번서울 중랑구 묵동 250-17복사",46,탕수육 괜찮았음..나머지는 그냥 저냥..,방문일 20.6.3.수 2020년 6월 3일 수요일 1번째 방문 인증 수단 영수증,점심에 방문
뻔뻔,요리주점,"도로명서울 중랑구 동일로149길 15 우성아파트 상가 1층(구, 중랑경찰서 맞은편)복사 지번서울 중랑구 묵동 250-17복사",47,ㅡ,방문일 21.1.13.수 2021년 1월 13일 수요일 1번째 방문 인증 수단 영수증,저녁에 방문
뻔뻔,요리주점,"도로명서울 중랑구 동일로149길 15 우성아파트 상가 1층(구, 중랑경찰서 맞은편)복사 지번서울 중랑구 묵동 250-17복사",48,굿굿 쬬아요오오오오옹,방문일 20.4.16.목 2020년 4월 16일 목요일 1번째 방문 인증 수단 매장주문,저녁에 방문
뻔뻔,요리주점,"도로명서울 중랑구 동일로149길 15 우성아파트 상가 1층(구, 중랑경찰서 맞은편)복사 지번서울 중랑구 묵동 250-17복사",49,깐풍기 먹었는데 중국집에서 먹는 것 보다 맛있었어요,방문일 23.10.6.금 2023년 10월 6일 금요일 1번째 방문 인증 수단 영수증,"저녁에 방문예약 없이 이용대기 시간 바로 입장데이트, 일상"
아지토,이자카야,도로명서울 중랑구 동일로 932 201동 1-103호복사 지번서울 중랑구 묵동 170-1복사,1,"또왔는데요, 또맛있습니다. 매번 새로운 메뉴가 개발되는 것도 멋지구요.  모쓰나베 깔끔하고 좋았습니다. 파스타, 가라아게는 말 할 것도 없구요.  항상 기분 좋아지는 공간입니다 💖 접기",방문일 1.10.토 2026년 1월 10일 토요일 2번째 방문 인증 수단 영수증,"밤에 방문예약 없이 이용대기 시간 바로 입장친목, 기념일친구, 지인・동료"
아지토,이자카야,도로명서울 중랑구 동일로 932 201동 1-103호복사 지번서울 중랑구 묵동 170-1복사,2,회사 동료와 2차로 또 다녀왔습니다(또간집) 😋 역시나 반갑게 맞이해주신 사장님! 😃 맛있게 잘 먹고 수다도 엄청 떨고 나왔네요 😄 다음번엔 새로운 음식으로 리뷰를 남겨야겠어요! 📝 #회사 #동료 #또간집 #사장님 #음식 #리뷰 접기,방문일 25.12.10.수 2025년 12월 10일 수요일 4번째 방문 인증 수단 영수증,밤에 방문예약 없이 이용대기 시간 바로 입장지인・동료
아지토,이자카야,도로명서울 중랑구 동일로 932 201동 1-103호복사 지번서울 중랑구 묵동 170-1복사,3,"회사 직원과 저녁 식사 후 집으로 가는 길에 맥주 한 잔이 생각나 아지토에 들러 혼술 했어요. 🍺 혼술 메뉴가 있어 좋았고, 사장님과 일본어로 대화가 가능해서 이런저런 이야기도 하며 맛있는 안주를 곁들여 맥주를 마셨답니다. 唐揚げは本当に日本の味がして美味しかったし刺し身もビール🍺も(笑) また行きます✨ 접기",방문일 25.11.27.목 2025년 11월 27일 목요일 3번째 방문 인증 수단 영수증,저녁에 방문예약 없이 이용대기 시간 바로 입장일상혼자
아지토,이자카야,도로명서울 중랑구 동일로 932 201동 1-103호복사 지번서울 중랑구 묵동 170-1복사,4,업체 사장님을 데리고 2차로 간 아지토..늦은 시간이었지만 반갑게 맞이해주셔서 감사합니다.^^ 뜨끈한 모츠나베에 추천 사케에 또 한 잔🍶 혼방 아지의 카라아게🧆 잘 숙성된 회🍣가 일품입니다~♡ #아지토 #모츠나베 #사케 #카라아게 #숙성회 접기,방문일 25.11.11.화 2025년 11월 11일 화요일 2번째 방문 인증 수단 영수증,밤에 방문예약 없이 이용대기 시간 바로 입장친목친구
아지토,이자카야,도로명서울 중랑구 동일로 932 201동 1-103호복사 지번서울 중랑구 묵동 170-1복사,5,"수원에서 온 친구를 위해 방문할 곳을 찾던 중, 아지토가 떠올라 사장님께 전화로 예약 후 방문하게 되었습니다. 📞 지난번 방문 시 좋은 추억이 있었기에 자연스럽게 생각난 것 같습니다. 😊 예상대로 친구도 매우 만족하며 맛있게 식사를 즐겼습니다. 😋 겨울 메뉴인 모츠나베는 된장 베이스의 국물 맛이 정말 훌륭했습니다. 🍲 서비스로 주신 가라아게는 일본에서 맛보았던 그 맛이었습니다. 🍗 후토마키를 포장해 와서 더욱 행복합니다. 🍣 접기",방문일 25.11.7.금 2025년 11월 7일 금요일 1번째 방문 인증 수단 영수증,저녁에 방문대기 시간 바로 입장친목친구
아지토,이자카야,도로명서울 중랑구 동일로 932 201동 1-103호복사 지번서울 중랑구 묵동 170-1복사,6,새해 첫 날 인생 이자카야 찾았습니다.. 근처에 평점 높은 곳이 있길래 가볍게 와본건데 메뉴 하나하나 너무 맛있고 분위기가 좋았어요. 1인 숙성회 양도 많고 퀄리티가 높아서 한 점씩 아껴 먹었습니다. 파스타도 나베도 전문점 맛이에요. 공간도 편안하고 운치있어서 여행하는 기분이었어요!! 동네 사시는 분들 부럽습니다..🥹 사장님도 친절하시고 손도 빠르세요. 주차도 편하니 안 올 이유가 없다!! 덕분에 새해를 세상 기분 좋게 시작합니다 강추해요.❤️❤️❤️ 접기,방문일 1.1.목 2026년 1월 1일 목요일 1번째 방문 인증 수단 결제내역,저녁에 방문예약 없이 이용대기 시간 바로 입장데이트연인・배우자
아지토,이자카야,도로명서울 중랑구 동일로 932 201동 1-103호복사 지번서울 중랑구 묵동 170-1복사,7,"사시미구성이 8종인데 전복도 포함되었고 두툼하니 지루하지 않게 먹을수있어요!! 고구마 쇼츄 어느 안주랑 잘어울리고 아지토 사장님의 수제 모찌리도후 꼭드세요~~ 두부아닙니다, 신선하고 녹진한 우유 버터 크림치즈 합체한 식감까지 만족스러운 어디에도 없는 맛입니다요 💗 접기",방문일 25.11.12.수 2025년 11월 12일 수요일 2번째 방문 인증 수단 결제내역,밤에 방문예약 없이 이용대기 시간 바로 입장데이트연인・배우자
아지토,이자카야,도로명서울 중랑구 동일로 932 201동 1-103호복사 지번서울 중랑구 묵동 170-1복사,8,3번째 방문인거 같은데 항상 갈때마다 사장님이 친절하게 반겨주시고~~~~음식도 진짜 맛있고 가성비입니다!!! 사장님 넘 내 스타일인데!!♡♡♡ 음식도 내 스타일이야~~~♡♡♡ 접기,방문일 25.12.25.목 2025년 12월 25일 목요일 2번째 방문 인증 수단 결제내역,저녁에 방문예약 후 이용대기 시간 바로 입장데이트연인・배우자
아지토,이자카야,도로명서울 중랑구 동일로 932 201동 1-103호복사 지번서울 중랑구 묵동 170-1복사,9,"결기로 선택한 ""아지토"" 이자카야~ 완전 반해버린 곳이예요🥰 간판부터 분위기 죽이고요 사장님 친절함은 왠일이야~~꺄악🤩 맛의 퀄리티는 일본이자카야 저리가라 입니다 그만큼 숙성회로 쫄깃하고 맛보장합니다!! 저희는 오마카세 형식으로 부탁을 드려서 코스로 먹었구요 와인도 정~~말 맛있었습니다 결기라 말씀드렸더니 초 해주신 센스 어쩔😭(갬동) 마지막에 모찌도후는 극락🫠🫠 이런 모찌도후는 첨 먹어봐요(또먹고싶다) 사장님께서도 자부심이 대단하시더라구요(인정!) 생각지도 못한 곳에서 귀한 대접받고 맛과 행복은 덤으로😄 사장님 너무 잘 먹었습니다 조만간 또 남편과 밤마실 가겠습니다🤗 접기",방문일 25.10.5.일 2025년 10월 5일 일요일 1번째 방문 인증 수단 영수증,저녁에 방문예약 없이 이용대기 시간 바로 입장기념일연인・배우자
아지토,이자카야,도로명서울 중랑구 동일로 932 201동 1-103호복사 지번서울 중랑구 묵동 170-1복사,10,"오픈한지 얼마 안됐는데 벌써 세번째 방문한 곳입니다ㅎ 매장 밖에서부터 숙성 냉장고 속 생선들이 발길을 멈추게 하고, 들어서면 젊고 잘생긴 사장님께서 친절하게 맞아주십니다🙋‍♂️ 1인 주방임에도 조리 속도가 생각보다 빠르고, 특히 모둠회는 첫 방문 때보다 점점 더 고소하고 감칠맛이 깊어져서 방문하신다면 숙성회는 무조건 강추합니다. 여기에 사장님이 추천해주시는 사케나 와인을 곁들이면 하루의 스트레스가 싹 날아가는듯 하네요🍶 비주얼이나 맛을 보면, 사장님이 음식에 얼마나 진심인지 그대로 느껴집니다🫶 이 정도 음식 퀄리티·분위기·서비스에 이 가격이면 솔직히 이 동네에서는 손에 꼽을 만큼 만족스러워서 지인들 놀러 오면 무조건 여기로 데려가고, 혼술하기에도 딱 좋아서 퇴근 후 가볍게 한잔하기에도 좋습니다👍 접기",방문일 25.10.6.월 2025년 10월 6일 월요일 1번째 방문 인증 수단 영수증,밤에 방문예약 후 이용대기 시간 바로 입장친목지인・동료
아지토,이자카야,도로명서울 중랑구 동일로 932 201동 1-103호복사 지번서울 중랑구 묵동 170-1복사,11,"저 멀리서부터 생선 숙성 냉장고가 있어서 ‘아 여긴 제대로 하는 곳이구나…’ 생각했는데 진짜였어요!! 기대 이상 이상,,,,(?)ㅌㅌㅋㅋㅌㅌㅋ 세비체랑 게 내장 파스타를 먹었는데 세비체는 우선 과일이 엄청 많고 신선해서 골라 먹는 재미가 있었고 회도 숙성회라서 쫄깃하고 소스도 맛있었습니당 게 내장 파스타는 그 녹진함이 살아 있어서 놀랐고 새우 크기에 다시 한번 놀랐고.,, 사람이 많아서 주문이 밀려서 서비스로 주신 모찌리도후도 부라타 치즈같이 맛있어서 좋았고 친절하셔서 좋았던!!!! 그냥 첨부터 다 좋았던 곳입니당 그리고 bgm이 엄청 클래식한데 로맨틱해서 분위기 잡고 싶은 날, 기념하고 싶은 날 가면 정말 좋을 것 같아요! 기억하실지 모르겠지만 사쟝님 또 갈게용~~~! 접기",방문일 25.10.8.수 2025년 10월 8일 수요일 1번째 방문 인증 수단 영수증,저녁에 방문예약 없이 이용대기 시간 바로 입장데이트연인・배우자
아지토,이자카야,도로명서울 중랑구 동일로 932 201동 1-103호복사 지번서울 중랑구 묵동 170-1복사,12,메뉴 보면 후토마끼 한정.. 이거이거 한정이라는말 너~~~무 인정!! 감탄하면서 먹었어요😱 어쩐지 다녀온지 4일뿐이 안됐는데 계속 후토마끼가 먹고 싶더라니... 지나가는길에 들려서 포장하길 정말 잘했네요(내자신뿌듯🤭) 안에 구성 좋고 영양만점! 2번뿐이 안갔는데 뭔가 단골된 너낌적인너낌??😅 사장님께서 따뜻한 미소로 맞아주시고 이야기 잘 들어주셔서 뭔가 내적 친밀감😝 오늘도 맛있게 잘 먹었어요💯👍 접기,방문일 25.10.9.목 2025년 10월 9일 목요일 2번째 방문 인증 수단 영수증,저녁에 방문예약 없이 이용대기 시간 바로 입장나들이연인・배우자
아지토,이자카야,도로명서울 중랑구 동일로 932 201동 1-103호복사 지번서울 중랑구 묵동 170-1복사,13,사장님 이렇게 잘하시면 너무 곤란해요 지금도 또 가고싶단말이예요🥹 민어회 이렇게 쫀득하고 맛있을줄 몰랐어요 그리구 진짜 정말 모든 메뉴가 정성스러웠어요:) 제발 파스타까지 모두 먹어주세요 다음에는 친구들 더 많이 데려갈게요 여기저기 소문내고 다닐테니까 꼭 오래오래 해주세요✨ 접기,방문일 25.8.28.목 2025년 8월 28일 목요일 1번째 방문 인증 수단 영수증,저녁에 방문예약 없이 이용대기 시간 바로 입장일상친척・형제자매
아지토,이자카야,도로명서울 중랑구 동일로 932 201동 1-103호복사 지번서울 중랑구 묵동 170-1복사,14,"모임 끝나고 집에 그냥 들어가기 아쉬워서 , 조용하고 혼술할 수 있는 가게를 찾다가 들렀어요  바에 앉아서 사장님이랑 소통하며 술먹는 재미가 있는 곳이네요  1인 메뉴도 많이 준비되어있어서 좋았습니다. 숙성회 맛있어요.  다양한 위스키와 사케가 있는데 오히려 가성비?가 있는 집이더라고요.. 한잔 가격이 합리적임. 접기",방문일 25.10.4.토 2025년 10월 4일 토요일 2번째 방문 인증 수단 영수증,저녁에 방문예약 없이 이용대기 시간 바로 입장일상혼자
아지토,이자카야,도로명서울 중랑구 동일로 932 201동 1-103호복사 지번서울 중랑구 묵동 170-1복사,15,안주와 술 페어링이 미친곳이에요! 다른곳에서는 느낄수없는 맛~~ 묵동의 축복🐽🫶🏻🩷,방문일 25.10.14.화 2025년 10월 14일 화요일 1번째 방문 인증 수단 영수증,밤에 방문예약 없이 이용대기 시간 바로 입장일상친구
아지토,이자카야,도로명서울 중랑구 동일로 932 201동 1-103호복사 지번서울 중랑구 묵동 170-1복사,16,"평소 숙성회를 좋아하는 사람으로써 이곳 숙성회 모둠 메뉴를 사랑합니다. 한 점 한 점 풍미가 살아있습니다. 오른쪽부터 순서대로 먹으면 되는데요, 훈연된 마지막 한 점까지 먹고 감탄했어요 ㅠㅠㅠ🍣🍶  모찌리도후는 매번 페어링이 달라져서 나오는 것 같은데 정말 부드럽고 폭신합니다 ㅎㅎ 디저트 좋아하시는 분은 꼭 드셔보세요🍑🍮  그리고 여기 감태전복파스타 맛집이에요 ㅋㅋ 꼭드세요 두번드세요 진짜 ㅋㅋㅋ 식사하러 와도 될정도입니다 ㅋㅋㅋ 소스 꾸덕하고 전복도 엄청 들어있는데요, 부드러운데 쫄깃한 식감이에요 ㅋㅋㅋ 이건 먹어봐야 알아요 🍝🐚 접기",방문일 25.8.2.토 2025년 8월 2일 토요일 1번째 방문 인증 수단 영수증,"저녁에 방문예약 후 이용대기 시간 바로 입장친목, 일상, 기념일친구"
아지토,이자카야,도로명서울 중랑구 동일로 932 201동 1-103호복사 지번서울 중랑구 묵동 170-1복사,17,안주 다 맛있어용😊😊😊,방문일 25.11.27.목 2025년 11월 27일 목요일 1번째 방문 인증 수단 영수증,저녁에 방문예약 없이 이용대기 시간 바로 입장친목친구
아지토,이자카야,도로명서울 중랑구 동일로 932 201동 1-103호복사 지번서울 중랑구 묵동 170-1복사,18,"사장님께서 메뉴에 고민을 많이 하신게 느껴질 정도로 모든 안주들이 너무너무 맛있는 곳이에요! 다른 곳에서는 보지못한 메뉴들도 많아서 굉장히 신선한 경험 했습니다! 너무 맛있게 먹느라 찍지 못한 음식들도 많은데 사장님께서 정말 정성으로 숙성시키신 모듬 숙성회(회가 진짜 두둠하고 아주 쫄깃쫄깃해요), 사시미 알배추 톳무침(짭쪼름한게 이거 아주 술도둑입니다👍), 그리고 사장님의 정성과 센스가 가득한 저 귀여운 못찌리도후가 맛도 아주 기가막힙니다~살짝 단맛이 느껴지는 크림치즈 느낌인데 여성분들은 꼭 시켜보셨으면 좋겠어요. 파스타 메뉴들도 아주 최고최고👍 너~무 맛있습니다! 진짜 여기 안주들 다 맛있어요! 분위기도 너무 좋아서 데이트하기에도 좋고 혼술하기에도 좋고 지인들끼리 조용히 모여서 한잔하기에도 딱일거 같아요~ 접기",방문일 25.8.16.토 2025년 8월 16일 토요일 1번째 방문 인증 수단 영수증,"밤에 방문예약 없이 이용대기 시간 바로 입장친목연인・배우자, 지인・동료"
아지토,이자카야,도로명서울 중랑구 동일로 932 201동 1-103호복사 지번서울 중랑구 묵동 170-1복사,19,"남자친구랑 소주를 즐겨먹는편인데 소주 생각이 나지않을정도로 사케가 너무 맛있어요 ,, 🥺 안주도 다양해서 좋았고 술이 살짝 아쉬울때 잔술 시켜먹으면 딱이더라구요 ٩꒰｡•◡•｡꒱۶ 매장이 굉장히 깔끔하고 분위기가 좋아서 커플분들 오시기 너무 좋을거같아요 !! 직장 근처에 좋은 술집이 생긴거같아서 너무 좋습니당 ❤️ 사장님두 잘생기시고 엄청 친절하시니 여자분들끼리 가도 너모 좋을거같아요 ^~^ ㅋㅋㅋ ㅋㅋㅋㅋㅋㅋㅋ 다음에는 칭구랑 둘이 갈까 고민즁입니다 ㅎㅎㅎ 접기",방문일 25.7.15.화 2025년 7월 15일 화요일 1번째 방문 인증 수단 영수증,저녁에 방문예약 없이 이용대기 시간 바로 입장데이트연인・배우자
아지토,이자카야,도로명서울 중랑구 동일로 932 201동 1-103호복사 지번서울 중랑구 묵동 170-1복사,20,"새로 오픈한 가게인 것 같아서 들어가봤는데, 기대 이상이네요.  특히 모둠 사시미와 사케 페어링이 매우 퀄리티가 높습니다.  술은 사케 말고도 기린 맥주, 위스키 등등.. 다양하게 있습니다.  근처에 조용하게 술먹을 위스키집이 없었는데 이번에 생겨서 자주 갈것 같아요 ㅎㅎ 접기",방문일 25.7.13.일 2025년 7월 13일 일요일 1번째 방문 인증 수단 영수증,"저녁에 방문예약 없이 이용대기 시간 바로 입장데이트, 기념일, 비즈니스, 나들이연인・배우자"
아지토,이자카야,도로명서울 중랑구 동일로 932 201동 1-103호복사 지번서울 중랑구 묵동 170-1복사,21,"정말 맛있었습니다.  첫방문이라 그런지 음식을 자세히 설명해주셨습니다. 어디가서 접해보지 못한 조합의 특별한 음식들이 너무 좋았습니다. 그릇, 인테리어, 조명, 온도가 정말 딱 알맞아 좋았습니다. 사장님께서 정말 친절했습니다.  일요일에 쉬는 점이 조금 아쉬웠습니다. 앞사람의 말을 듣기가 조금 힘들었습니다.  특별한 날이 아니어도 좋은사람과 함께라면 자주 방문하고싶어지는 가게였습니다. 접기",방문일 25.8.2.토 2025년 8월 2일 토요일 1번째 방문 인증 수단 영수증,저녁에 방문예약 없이 이용대기 시간 10분 이내 기념일친구
아지토,이자카야,도로명서울 중랑구 동일로 932 201동 1-103호복사 지번서울 중랑구 묵동 170-1복사,22,"우선 안주 퀄리티가 너무 좋구요, 세비체 플레이팅부터 맛까지 다 너무 좋았습니다. 소스 맛이 독창적이어서 놀랐습니다. 모찌리도후도 그냥 보통 가게에서 파는 느낌이 아니었습니다. 음식 퀄이 다 정말 좋습니다. 술 종류가 굉장히 다양해서 골라마실 수 있는 재미가 있습니다. 저는 혼자 왔는데, 부담스럽지 않았서 좋았습니다. 사장님께서 음식 솜씨가 참 좋으시고 친절하셔서 좋습니다. 재방문 의사 있고 자주 올 것 같습니다. 접기",방문일 25.7.16.수 2025년 7월 16일 수요일 1번째 방문 인증 수단 결제내역,저녁에 방문예약 없이 이용대기 시간 바로 입장일상혼자
아지토,이자카야,도로명서울 중랑구 동일로 932 201동 1-103호복사 지번서울 중랑구 묵동 170-1복사,23,우연히 가오픈때 방문하게됐는데 사장님이 너무 친절하시구~안주도 넘예쁘고 맛있어요~🙂2차하기좋고 조용해서 데이트할때 오기좋아요! 이주변 오게돼면 또오려구요ㅎㅎ🫶🏻🥂 접기,방문일 25.7.25.금 2025년 7월 25일 금요일 2번째 방문 인증 수단 영수증,저녁에 방문예약 없이 이용대기 시간 바로 입장데이트연인・배우자
아지토,이자카야,도로명서울 중랑구 동일로 932 201동 1-103호복사 지번서울 중랑구 묵동 170-1복사,24,스파게티 너무 맛나요~~ 사시미도 싱싱하니 맛있어요.^. 사장님 친절하시고 또오고싶은 장소인거같아요.. 음악도 옛날 감성으로 너무너무 좋아여~~ 담에 또 올께여.~. 접기,방문일 25.7.30.수 2025년 7월 30일 수요일 1번째 방문 인증 수단 영수증,저녁에 방문예약 없이 이용대기 시간 바로 입장친목친구
아지토,이자카야,도로명서울 중랑구 동일로 932 201동 1-103호복사 지번서울 중랑구 묵동 170-1복사,25,음식이 신선하고 맛있어서 계속 방문하고 싶은 곳입니다.사장님도 친절하시고 음식맛에 대해 꾸준히 소통하려고 하셔서 더 만족스럽습니다. 요즘 보기 드문 직접 요리하시는 귀한 이자카야입니다. 접기,방문일 25.8.12.화 2025년 8월 12일 화요일 1번째 방문 인증 수단 영수증,저녁에 방문예약 없이 이용대기 시간 바로 입장데이트연인・배우자
아지토,이자카야,도로명서울 중랑구 동일로 932 201동 1-103호복사 지번서울 중랑구 묵동 170-1복사,26,올여름 첫 민어 먹어봤는데 맛있게 잘먹었습니다,방문일 25.8.12.화 2025년 8월 12일 화요일 1번째 방문 인증 수단 영수증,"저녁에 방문예약 없이 이용대기 시간 바로 입장데이트, 일상"
아지토,이자카야,도로명서울 중랑구 동일로 932 201동 1-103호복사 지번서울 중랑구 묵동 170-1복사,27,"새로생긴곳은 가보는 편입니다. 맛있음 양적음, 비쌈 가성비면에서 글쎄입니다.. 번창되시길.. 접기",방문일 25.8.16.토 2025년 8월 16일 토요일 1번째 방문 인증 수단 결제내역,저녁에 방문예약 후 이용대기 시간 바로 입장가족모임지인・동료
