name,category,address,review_index,review_text,review_info,visit_time
육연식당 묵동본점,일식당,도로명서울 중랑구 동일로 932 1층 104호복사 지번서울 중랑구 묵동 170-1복사,32,양도 많고 음식은 너무 맛나고 직원분들도 친절하세요. 올때마다 항상 만족해요. 오늘도 넘 맛나게 먹고 왔습니다.^^~,방문일 25.11.6.목 2025년 11월 6일 목요일 3번째 방문 인증 수단 영수증,저녁에 방문예약 없이 이용대기 시간 바로 입장일상친구
육연식당 묵동본점,일식당,도로명서울 중랑구 동일로 932 1층 104호복사 지번서울 중랑구 묵동 170-1복사,33,"너무너무 맛있어요!! 연어랑 육회에 꽂혀서 검색해서 갑자기 찾아온 집인데 너무 맛있었어요! 연어도 진짜 신선하고 육회도 맛있어요💗 찐 내돈내산 리뷰이고, 당분간 자주 올 것 같아요 양도 푸짐하게 주셔서 무한리필할때 눈치 안보이고 너무 좋았어요 매장도 깔끔합니다-! 접기",방문일 25.11.7.금 2025년 11월 7일 금요일 1번째 방문 인증 수단 영수증,저녁에 방문예약 없이 이용대기 시간 바로 입장데이트연인・배우자
육연식당 묵동본점,일식당,도로명서울 중랑구 동일로 932 1층 104호복사 지번서울 중랑구 묵동 170-1복사,34,종종 사먹는데 역시 맛있습니다. 양도 많고 빨리 나오고 최고입니다.^^ 먹골오면 항상 여기서 먹어요~~,방문일 1.5.월 2026년 1월 5일 월요일 1번째 방문 인증 수단 영수증,점심에 방문예약 없이 이용대기 시간 바로 입장일상친척・형제자매
육연식당 묵동본점,일식당,도로명서울 중랑구 동일로 932 1층 104호복사 지번서울 중랑구 묵동 170-1복사,35,음식이 맛있고 매장 깨끗합니다! 강추합니다.,방문일 1.12.월 2026년 1월 12일 월요일 1번째 방문 인증 수단 영수증,저녁에 방문예약 없이 이용대기 시간 바로 입장데이트연인・배우자
육연식당 묵동본점,일식당,도로명서울 중랑구 동일로 932 1층 104호복사 지번서울 중랑구 묵동 170-1복사,36,항상 친절하시고 음식도 맛있습니다!,방문일 1.10.토 2026년 1월 10일 토요일 1번째 방문 인증 수단 영수증,점심에 방문예약 없이 이용대기 시간 바로 입장친목지인・동료
육연식당 묵동본점,일식당,도로명서울 중랑구 동일로 932 1층 104호복사 지번서울 중랑구 묵동 170-1복사,37,맛있어요!!! 가성비도 좋아요,방문일 1.4.일 2026년 1월 4일 일요일 2번째 방문 인증 수단 결제내역,저녁에 방문예약 없이 이용대기 시간 바로 입장데이트연인・배우자
육연식당 묵동본점,일식당,도로명서울 중랑구 동일로 932 1층 104호복사 지번서울 중랑구 묵동 170-1복사,38,"연어, 육회 다 맛있고 친절합니다 💓",방문일 25.12.7.일 2025년 12월 7일 일요일 1번째 방문 인증 수단 영수증,"점심에 방문예약 없이 이용대기 시간 바로 입장데이트, 친목, 나들이, 가족모임"
육연식당 묵동본점,일식당,도로명서울 중랑구 동일로 932 1층 104호복사 지번서울 중랑구 묵동 170-1복사,39,아이들과 함께 방문했어요 육회 연어 다 맛있다고 잘먹어요. 담에 또 와서 먹을게오~,방문일 25.12.24.수 2025년 12월 24일 수요일 1번째 방문 인증 수단 영수증,저녁에 방문예약 후 이용대기 시간 바로 입장가족모임아이
육연식당 묵동본점,일식당,도로명서울 중랑구 동일로 932 1층 104호복사 지번서울 중랑구 묵동 170-1복사,40,연어대뱃살 초밥 시켰어요. 넘 맛있어서 먹다가 생각나서 찍엇네요.초4. 초6 아이들이 입에서 살살 녹는다고 하네요. 짱짱. 넘 맛있어요. 육회 연어 무한도 있다고 하니. 담에 또 와야 겠어요. 아참. 여기 직원분들 엄청 친절 하세요~!! 접기,방문일 25.12.4.목 2025년 12월 4일 목요일 1번째 방문 인증 수단 영수증,점심에 방문예약 없이 이용대기 시간 바로 입장일상아이
육연식당 묵동본점,일식당,도로명서울 중랑구 동일로 932 1층 104호복사 지번서울 중랑구 묵동 170-1복사,41,자주오는데 싸고 맛있어요!!연어도 신선하고 계속 올거같아용,방문일 25.12.27.토 2025년 12월 27일 토요일 3번째 방문 인증 수단 영수증,저녁에 방문예약 없이 이용대기 시간 바로 입장친목친구
육연식당 묵동본점,일식당,도로명서울 중랑구 동일로 932 1층 104호복사 지번서울 중랑구 묵동 170-1복사,42,언제나 맛나요. 재료도 신선하고 정말 최고의 맛입니다. 혼자와도 좋고. 같이 오는 사람들이 다들 맛나다고 하네요~~ 접기,방문일 25.10.25.토 2025년 10월 25일 토요일 2번째 방문 인증 수단 영수증,저녁에 방문예약 없이 이용대기 시간 바로 입장일상아이
육연식당 묵동본점,일식당,도로명서울 중랑구 동일로 932 1층 104호복사 지번서울 중랑구 묵동 170-1복사,43,퇴근하고 11시쯤 방문했는데 혼밥하기도 좋고 맛있습니다 ㅎㅎ 다음에 재방문할게요,방문일 25.10.30.목 2025년 10월 30일 목요일 2번째 방문 인증 수단 영수증,밤에 방문예약 없이 이용대기 시간 바로 입장일상혼자
육연식당 묵동본점,일식당,도로명서울 중랑구 동일로 932 1층 104호복사 지번서울 중랑구 묵동 170-1복사,44,육회 연어 먹고싶을때는 무조건 여기옵니다 항상올때마다 만족하고갑니다!,방문일 1.9.금 2026년 1월 9일 금요일 2번째 방문 인증 수단 영수증,저녁에 방문예약 없이 이용대기 시간 바로 입장가족모임부모님
육연식당 묵동본점,일식당,도로명서울 중랑구 동일로 932 1층 104호복사 지번서울 중랑구 묵동 170-1복사,45,항상 육회연어하면 생각나는곳이에여~~ 육회연어 모두 신선하거 너무너무 맛있어요 !̌̈ !,방문일 25.12.8.월 2025년 12월 8일 월요일 3번째 방문 인증 수단 영수증,저녁에 방문예약 없이 이용대기 시간 바로 입장데이트연인・배우자
육연식당 묵동본점,일식당,도로명서울 중랑구 동일로 932 1층 104호복사 지번서울 중랑구 묵동 170-1복사,46,"육연식당 목동본점은 언제 가도 만족스러운 곳이에요. 이번에도 예약 없이 바로 입장했는데 직원분들이 친절하게 안내해주셨습니다.  육회, 연어 사시미, 소고기 육사시미가 모두 신선하고 고소해 재료의 퀄리티가 느껴졌어요. 곁들임 채소와 소스도 깔끔하게 준비돼 있어 취향대로 즐길 수 있었고, 특히 연어는 두툼하면서도 부드럽고 육회는 고소하고 담백해 정말 맛있었습니다. 깔끔한 플레이팅 덕분에 눈으로도 한 번 더 즐길 수 있었고, 가성비도 좋아서 만족스러웠어요. 친구들과 오붓하게 대화하며 맛있게 즐기기 좋은 곳이라 재방문 의사 100%입니다. 접기",방문일 25.9.3.수 2025년 9월 3일 수요일 2번째 방문 인증 수단 영수증,저녁에 방문예약 없이 이용대기 시간 바로 입장친목친구
육연식당 묵동본점,일식당,도로명서울 중랑구 동일로 932 1층 104호복사 지번서울 중랑구 묵동 170-1복사,47,신선하고 되게 맛있어요 간단하게 먹기도 좋고 늘 맛있네요 ! 잘 먹겠습니다 ~~,방문일 25.10.20.월 2025년 10월 20일 월요일 3번째 방문 인증 수단 영수증,점심에 방문예약 없이 이용대기 시간 바로 입장데이트연인・배우자
육연식당 묵동본점,일식당,도로명서울 중랑구 동일로 932 1층 104호복사 지번서울 중랑구 묵동 170-1복사,48,맛있고 푸짐해서 잘 먹었습니다:),방문일 25.11.27.목 2025년 11월 27일 목요일 1번째 방문 인증 수단 영수증,점심에 방문예약 없이 이용대기 시간 바로 입장친목친구
육연식당 묵동본점,일식당,도로명서울 중랑구 동일로 932 1층 104호복사 지번서울 중랑구 묵동 170-1복사,49,역시 맛있어요 🙏🙏👍👍👍👍,방문일 1.5.월 2026년 1월 5일 월요일 1번째 방문 인증 수단 영수증,점심에 방문예약 없이 이용대기 시간 바로 입장데이트연인・배우자
육연식당 묵동본점,일식당,도로명서울 중랑구 동일로 932 1층 104호복사 지번서울 중랑구 묵동 170-1복사,50,배고플때마 오는 곳이에요~~ 곱배기는 필수!!! 짱맛~~~~,방문일 25.12.8.월 2025년 12월 8일 월요일 6번째 방문 인증 수단 결제내역,점심에 방문예약 없이 이용대기 시간 바로 입장친목
황금마차,포장마차,도로명서울 중랑구 중랑역로 154 황금마차복사 지번서울 중랑구 묵동 245-70복사,1,부대찌개랑 조기구이 먹었어요. 음식도 맛있고 사장님도 항상 친절하셔서 좋아요.,방문일 25.10.31.금 2025년 10월 31일 금요일 8번째 방문 인증 수단 영수증,저녁에 방문예약 없이 이용대기 시간 바로 입장일상연인・배우자
황금마차,포장마차,도로명서울 중랑구 중랑역로 154 황금마차복사 지번서울 중랑구 묵동 245-70복사,2,조기구이랑 부대찌개 먹었어요. 넘 친절하시고 음식도 맛있어요💕,방문일 25.9.26.금 2025년 9월 26일 금요일 7번째 방문 인증 수단 영수증,저녁에 방문예약 없이 이용대기 시간 바로 입장일상연인・배우자
황금마차,포장마차,도로명서울 중랑구 중랑역로 154 황금마차복사 지번서울 중랑구 묵동 245-70복사,3,곱창볶음 가성비 미쳤고 존맛이구요..쌈도 말씀드리면 주시고 주먹밥 사이드메뉴도 맛있고 기본안주 오이랑 국물도 너무좋아요ㅠㅜ 산낙지도 시켰는데 가성비 대비 맛있었어요🥹 술이 술술 들어가요 황금마차 단골될거예요!! 접기,방문일 25.6.16.월 2025년 6월 16일 월요일 1번째 방문 인증 수단 영수증,저녁에 방문예약 없이 이용대기 시간 바로 입장데이트연인・배우자
황금마차,포장마차,도로명서울 중랑구 중랑역로 154 황금마차복사 지번서울 중랑구 묵동 245-70복사,4,언제가도 편안한 곳이에요.,방문일 25.9.29.월 2025년 9월 29일 월요일 5번째 방문 인증 수단 결제내역,저녁에 방문예약 없이 이용대기 시간 바로 입장일상친구
황금마차,포장마차,도로명서울 중랑구 중랑역로 154 황금마차복사 지번서울 중랑구 묵동 245-70복사,5,맛나게 잘 먹고 왔어요.,방문일 25.6.21.토 2025년 6월 21일 토요일 4번째 방문 인증 수단 결제내역,저녁에 방문예약 없이 이용대기 시간 바로 입장친구
황금마차,포장마차,도로명서울 중랑구 중랑역로 154 황금마차복사 지번서울 중랑구 묵동 245-70복사,6,2차로 소주 한 잔 하러 갔어요. 조기구이도 바싹 잘 구워주셔서 맛있고 제육볶음도 맛있었어요. 사장님 늘 건강하셔요.,방문일 24.12.31.화 2024년 12월 31일 화요일 6번째 방문 인증 수단 영수증,저녁에 방문예약 없이 이용대기 시간 바로 입장일상연인・배우자
황금마차,포장마차,도로명서울 중랑구 중랑역로 154 황금마차복사 지번서울 중랑구 묵동 245-70복사,7,"꼼장어, 조기구이, 계란말이 먹었어요. 술이 술술 들어가요.",방문일 24.11.8.금 2024년 11월 8일 금요일 5번째 방문 인증 수단 영수증,저녁에 방문예약 없이 이용대기 시간 바로 입장일상연인・배우자
황금마차,포장마차,도로명서울 중랑구 중랑역로 154 황금마차복사 지번서울 중랑구 묵동 245-70복사,8,"자주 가다가 한동안 못 가 오랜만에 들렸습니다. 사장님 여전히 친절하시고, 음식도 맛났어요. 가보시면 후회 안할거에요.",방문일 24.12.10.화 2024년 12월 10일 화요일 2번째 방문 인증 수단 영수증,저녁에 방문예약 없이 이용대기 시간 바로 입장일상친구
황금마차,포장마차,도로명서울 중랑구 중랑역로 154 황금마차복사 지번서울 중랑구 묵동 245-70복사,9,단골집인데 늦은시간에 갔더니 테이블 만석... 사장님..대박나세요^^,방문일 25.1.7.화 2025년 1월 7일 화요일 3번째 방문 인증 수단 영수증,밤에 방문예약 없이 이용대기 시간 바로 입장일상친구
황금마차,포장마차,도로명서울 중랑구 중랑역로 154 황금마차복사 지번서울 중랑구 묵동 245-70복사,10,조금씯 다양하게 맛볼수 있도록 적은양에 낮은 금액 안주 3~4 개는 먹어야 성이참 맛있음,방문일 24.11.23.토 2024년 11월 23일 토요일 1번째 방문 인증 수단 결제내역,"저녁에 방문예약 없이 이용대기 시간 10분 이내 데이트, 친목"
황금마차,포장마차,도로명서울 중랑구 중랑역로 154 황금마차복사 지번서울 중랑구 묵동 245-70복사,11,늦은시간 안주 포장해서 잘 먹었습니다,방문일 24.9.2.월 2024년 9월 2일 월요일 1번째 방문 인증 수단 영수증,점심에 방문예약 없이 이용
황금마차,포장마차,도로명서울 중랑구 중랑역로 154 황금마차복사 지번서울 중랑구 묵동 245-70복사,12,요즘포장마차는 저렴하고 맛있는거랑은 거리가멀어요,방문일 24.8.30.금 2024년 8월 30일 금요일 1번째 방문 인증 수단 영수증,저녁에 방문예약 없이 이용대기 시간 바로 입장일상친구
황금마차,포장마차,도로명서울 중랑구 중랑역로 154 황금마차복사 지번서울 중랑구 묵동 245-70복사,13,친절하시고 너무 맛있어요ㅎ,방문일 24.6.7.금 2024년 6월 7일 금요일 3번째 방문 인증 수단 영수증,저녁에 방문
황금마차,포장마차,도로명서울 중랑구 중랑역로 154 황금마차복사 지번서울 중랑구 묵동 245-70복사,14,친절하시고 곱창 후기좋아서 곱창시켰는데 닭똥집을 더 맛있게먹었어요👍🏻늦게까지 사람많고 또 갈게요 담엔 치즈계란말이 오돌뼈를ㅎㅎ,방문일 24.5.7.화 2024년 5월 7일 화요일 1번째 방문 인증 수단 결제내역,밤에 방문
황금마차,포장마차,도로명서울 중랑구 중랑역로 154 황금마차복사 지번서울 중랑구 묵동 245-70복사,15,아주 괜찮은 해산물 포차 술이 절로 땡기는 안주들이 꽤 있다,방문일 24.3.6.수 2024년 3월 6일 수요일 1번째 방문 인증 수단 영수증,밤에 방문예약 없이 이용대기 시간 바로 입장일상
황금마차,포장마차,도로명서울 중랑구 중랑역로 154 황금마차복사 지번서울 중랑구 묵동 245-70복사,16,사장님도 친절하시고 안주도 맛나요. 노래도 좋고.. ㅜ 추천합니다.,방문일 23.12.9.토 2023년 12월 9일 토요일 1번째 방문 인증 수단 결제내역,저녁에 방문
황금마차,포장마차,도로명서울 중랑구 중랑역로 154 황금마차복사 지번서울 중랑구 묵동 245-70복사,17,곱창 너무 맛있어요,방문일 23.12.2.토 2023년 12월 2일 토요일 1번째 방문 인증 수단 영수증,저녁에 방문
황금마차,포장마차,도로명서울 중랑구 중랑역로 154 황금마차복사 지번서울 중랑구 묵동 245-70복사,18,중간가격에..양이적어요..,방문일 23.12.10.일 2023년 12월 10일 일요일 2번째 방문 인증 수단 결제내역,밤에 방문예약 없이 이용대기 시간 바로 입장일상지인・동료
황금마차,포장마차,도로명서울 중랑구 중랑역로 154 황금마차복사 지번서울 중랑구 묵동 245-70복사,19,굿,방문일 24.2.5.월 2024년 2월 5일 월요일 1번째 방문 인증 수단 영수증,저녁에 방문예약 없이 이용
황금마차,포장마차,도로명서울 중랑구 중랑역로 154 황금마차복사 지번서울 중랑구 묵동 245-70복사,20,사장님 음식솜씨 대박이에요!!!! 완전 JMT.. 미쳤어요 자주 방문할께요!!!!,방문일 23.6.11.일 2023년 6월 11일 일요일 1번째 방문 인증 수단 영수증,저녁에 방문
황금마차,포장마차,도로명서울 중랑구 중랑역로 154 황금마차복사 지번서울 중랑구 묵동 245-70복사,21,술 한잔하기 너무너무 좋아요!,방문일 23.3.27.월 2023년 3월 27일 월요일 1번째 방문 인증 수단 영수증,저녁에 방문
황금마차,포장마차,도로명서울 중랑구 중랑역로 154 황금마차복사 지번서울 중랑구 묵동 245-70복사,22,이모님도 너무 친절하시구 정말 모든 메뉴가 다 맛있구 좋아요:) 특히 전이 진짜 맛있어요 양도 푸짐하구요💕,방문일 23.4.4.화 2023년 4월 4일 화요일 1번째 방문 인증 수단 영수증,밤에 방문
황금마차,포장마차,도로명서울 중랑구 중랑역로 154 황금마차복사 지번서울 중랑구 묵동 245-70복사,23,가격이싼게아님 알고보면양이엄청적게나와또시켜야됨...결론은돈마니나옴,방문일 23.5.1.월 2023년 5월 1일 월요일 1번째 방문 인증 수단 영수증,저녁에 방문
황금마차,포장마차,도로명서울 중랑구 중랑역로 154 황금마차복사 지번서울 중랑구 묵동 245-70복사,24,굿,방문일 23.3.11.토 2023년 3월 11일 토요일 1번째 방문 인증 수단 영수증,저녁에 방문
역전할머니맥주 서울묵동점,"맥주,호프","도로명서울 중랑구 동일로 932 201동 1-105, 1-106호복사 지번서울 중랑구 묵동 170-1복사",1,"역전할맥은 2차로 맥주마시기 정말 좋습니다 ""묵동에 할맥이 있어서 방문했습니다"" 헛깨차가 있어서 좋았습니다 ^^",방문일 25.12.20.토 2025년 12월 20일 토요일 1번째 방문 인증 수단 영수증,저녁에 방문예약 없이 이용대기 시간 바로 입장친목친구
역전할머니맥주 서울묵동점,"맥주,호프","도로명서울 중랑구 동일로 932 201동 1-105, 1-106호복사 지번서울 중랑구 묵동 170-1복사",2,떡볶이 먹으러 갔는데 앉으니까 또 이거저거 시키게 되네용 집주변에 역전할매가 있어서 너무 조아여 안주 다 맛나고 밥먹으러도 옵니다잉,방문일 25.12.28.일 2025년 12월 28일 일요일 1번째 방문 인증 수단 영수증,저녁에 방문예약 없이 이용대기 시간 바로 입장데이트연인・배우자
역전할머니맥주 서울묵동점,"맥주,호프","도로명서울 중랑구 동일로 932 201동 1-105, 1-106호복사 지번서울 중랑구 묵동 170-1복사",3,매장도 넓은데 조용하니 대화하기 너무 좋아요 안주는 믿고 먹는거라 너무 좋았는데 새로나온 신메뉴들도 맛있으니까 다들 도전해보세요!,방문일 25.12.6.토 2025년 12월 6일 토요일 1번째 방문 인증 수단 영수증,밤에 방문예약 없이 이용대기 시간 바로 입장데이트연인・배우자
역전할머니맥주 서울묵동점,"맥주,호프","도로명서울 중랑구 동일로 932 201동 1-105, 1-106호복사 지번서울 중랑구 묵동 170-1복사",4,역전 여러 군데 가봤는데 여기가 최고에요! 직원들이 친절하고 음식이 맛있어요 특히 사장님께서 웃으시면서 서빙하는 모습에 더 맛있게 먹을 수 있었던 것 같아요 앞으로 장사 잘되서 더 많은 사람들이 이용할 수 있었으면 좋겠어요 ㅎ ㅎ 접기,방문일 25.11.16.일 2025년 11월 16일 일요일 1번째 방문 인증 수단 영수증,저녁에 방문예약 없이 이용대기 시간 바로 입장친목친구
역전할머니맥주 서울묵동점,"맥주,호프","도로명서울 중랑구 동일로 932 201동 1-105, 1-106호복사 지번서울 중랑구 묵동 170-1복사",5,힘든날에는 할맥에서 맥주와 떡볶이죠 안주도 최고고 맥주도 넘 맛있어요 ㅜㅜ 최고에여,방문일 25.10.17.금 2025년 10월 17일 금요일 1번째 방문 인증 수단 영수증,밤에 방문예약 없이 이용대기 시간 바로 입장일상친척・형제자매
역전할머니맥주 서울묵동점,"맥주,호프","도로명서울 중랑구 동일로 932 201동 1-105, 1-106호복사 지번서울 중랑구 묵동 170-1복사",6,일단 역할맥 가성비가 너무 좋아서 간술하기에 딱이에요❤️ 그리고 맥주에 살얼음 덕분에 시간 지나도 그대로 시원합니당!!,방문일 25.12.28.일 2025년 12월 28일 일요일 1번째 방문 인증 수단 영수증,밤에 방문예약 없이 이용대기 시간 바로 입장친목친구
역전할머니맥주 서울묵동점,"맥주,호프","도로명서울 중랑구 동일로 932 201동 1-105, 1-106호복사 지번서울 중랑구 묵동 170-1복사",7,맥주는 역시 할맥이죠~ 가성비짱!!!,방문일 25.11.26.수 2025년 11월 26일 수요일 3번째 방문 인증 수단 영수증,저녁에 방문예약 없이 이용대기 시간 바로 입장친목친구
역전할머니맥주 서울묵동점,"맥주,호프","도로명서울 중랑구 동일로 932 201동 1-105, 1-106호복사 지번서울 중랑구 묵동 170-1복사",8,맛있게 먹고 있어요 직원분도 친절하고 깔끔하네요,방문일 25.12.8.월 2025년 12월 8일 월요일 1번째 방문 인증 수단 영수증,저녁에 방문예약 없이 이용대기 시간 바로 입장데이트연인・배우자
역전할머니맥주 서울묵동점,"맥주,호프","도로명서울 중랑구 동일로 932 201동 1-105, 1-106호복사 지번서울 중랑구 묵동 170-1복사",9,가성비가 너무 좋아요 어묵탕과 냉면 시켰는데 너무 맛있네요,방문일 25.12.4.목 2025년 12월 4일 목요일 1번째 방문 인증 수단 영수증,저녁에 방문예약 없이 이용대기 시간 바로 입장친목친구
역전할머니맥주 서울묵동점,"맥주,호프","도로명서울 중랑구 동일로 932 201동 1-105, 1-106호복사 지번서울 중랑구 묵동 170-1복사",10,역할은 간단하게 먹기도 좋구 안주도 다엉해서 너무 좋아요 !!!,방문일 25.12.3.수 2025년 12월 3일 수요일 1번째 방문 인증 수단 영수증,저녁에 방문예약 없이 이용대기 시간 바로 입장데이트연인・배우자
역전할머니맥주 서울묵동점,"맥주,호프","도로명서울 중랑구 동일로 932 201동 1-105, 1-106호복사 지번서울 중랑구 묵동 170-1복사",11,"가볍고 시원하게 맥주, 하이볼 한잔하고 싶을 때, 부담 없는 가성비 주점으로 최고의 선택입니다. 친절하고 유쾌한 분위기를 즐길 수 있는 곳으로 추천해요.  파전삼합 굿!!! 접기",방문일 25.9.3.수 2025년 9월 3일 수요일 1번째 방문 인증 수단 영수증,저녁에 방문예약 없이 이용대기 시간 바로 입장일상부모님
역전할머니맥주 서울묵동점,"맥주,호프","도로명서울 중랑구 동일로 932 201동 1-105, 1-106호복사 지번서울 중랑구 묵동 170-1복사",12,집 근처라 가볍게 들렀는데 기대 이상이었어요! 안주도 전반적으로 가성비 좋고 양도 넉넉해서 친구들이랑 편하게 먹기 좋았습니다.!!😬😬☺️☺️☺️☺️,방문일 25.11.21.금 2025년 11월 21일 금요일 1번째 방문 인증 수단 영수증,밤에 방문예약 없이 이용대기 시간 바로 입장친목친구
역전할머니맥주 서울묵동점,"맥주,호프","도로명서울 중랑구 동일로 932 201동 1-105, 1-106호복사 지번서울 중랑구 묵동 170-1복사",13,가성비도 좋고 너무 분위기 좋아요~^^,방문일 25.11.19.수 2025년 11월 19일 수요일 2번째 방문 인증 수단 영수증,저녁에 방문예약 없이 이용대기 시간 바로 입장친목친구
역전할머니맥주 서울묵동점,"맥주,호프","도로명서울 중랑구 동일로 932 201동 1-105, 1-106호복사 지번서울 중랑구 묵동 170-1복사",14,음식이 맛있어요,방문일 25.12.31.수 2025년 12월 31일 수요일 1번째 방문 인증 수단 영수증,저녁에 방문예약 없이 이용대기 시간 바로 입장데이트친구
역전할머니맥주 서울묵동점,"맥주,호프","도로명서울 중랑구 동일로 932 201동 1-105, 1-106호복사 지번서울 중랑구 묵동 170-1복사",15,내부도 너무 좋고 소세지가 너무너무 맛있어요 간술하기 좋은 것 같아용 좋아요!!,방문일 25.9.17.수 2025년 9월 17일 수요일 1번째 방문 인증 수단 영수증,밤에 방문예약 없이 이용대기 시간 바로 입장데이트연인・배우자
역전할머니맥주 서울묵동점,"맥주,호프","도로명서울 중랑구 동일로 932 201동 1-105, 1-106호복사 지번서울 중랑구 묵동 170-1복사",16,"가성비도 좋고, 너무 너무 친절해요. 맥주 땡길때는 무조건 GoGo!!!",방문일 25.11.5.수 2025년 11월 5일 수요일 1번째 방문 인증 수단 영수증,저녁에 방문예약 없이 이용대기 시간 바로 입장친목친구
역전할머니맥주 서울묵동점,"맥주,호프","도로명서울 중랑구 동일로 932 201동 1-105, 1-106호복사 지번서울 중랑구 묵동 170-1복사",17,사장님이 맛있고 음식이 친절해요,방문일 1.1.목 2026년 1월 1일 목요일 1번째 방문 인증 수단 영수증,저녁에 방문예약 없이 이용대기 시간 바로 입장데이트연인・배우자
